masked sentence,expected
"Recognizing a soulmate can be as [MASK] as a moment in the sunshine, or a meeting of eyes over a cup of coffee.",sudden
"As long as you can drive away from their shop without toppling over or crashing into something or someone, you're as [MASK] as a bird.",free
The Fraud Triangle Fraud is as [MASK] as a virus and can be just as menacing.,common
"Many eclipses are jarring, but not this one this one is as [MASK] as a cupcake with vanilla icing, so it may be that your friend will do something for you that you find touching.",sweet
"How many of you guys would say no to dating a girl who is as [MASK] as a cow, always silent (apart from occassional sexy moos), and can make Pamela Anderson feel sorry with her udders?",healthy
"No, the room was not cold at all, but my heartoh, dismaymy heart was as [MASK] as ice.",cold
"Irregular Choice is as [MASK] as a child in a sweetie shop to announce our first Irregular Choice Kids collection will be launching this Friday at 12 pm ( UK Time ) Our fans have been asking owner and Designer Dan Sullivan to create a children's  collection for years and he has worked hard to make their dreams come true, developing this capsule kid In preparation for us launching our SWAN HEELS at midday tomorrow we are giving lucky fans the chance to WIN their very own Swan Planters filled with Irregular Choice flowers!",excited
As I got closer to finally see what was in store for me Dan said my eyes were as [MASK] as saucers and my jaw dropped.,big
"A car can become as [MASK] as an oven very quickly, even when it doesn't feel that warm.",hot
"Travel journals were as [MASK] as theatergoing, and stories from the new world abounded.",popular
"Best of all, Stott's text is as [MASK] as Harlequin's moves, his eye for humour and the need to clarify details for those unschooled in that period always as deft and sure.",light
"car can be as [MASK] as home itself: the safety belts, the side protection wings to delicately support the baby?",comfortable
"The irony of my plastic works is that I take a material that was created to be touched, and I make it as [MASK] as an artwork.",inaccessible
"The messengers of love should be as [MASK] as thoughts, traveling ten times faster than sunbeams, pushing all doubts and fears away, as light does to threatening shadows.",light
The water now was as [MASK] as a sheet of glass and reflected in it was a magnificent magenta sunset-it was a perfect ending.,calm
GED Reasoning Through Language Arts : Literary Elements Have you ever been as [MASK] as a bull when you're trying to study and nothing seems to work?,angry
"Great herds of tame cattle grazed the pastures, the water in the streams was as [MASK] as crystal and as fragrant as clover, while the hillsides shone with veins of white, black, and red marble and with deposits of every kind of precious metal.",clear
You will be amazed to see your grapes will be as [MASK] as sugar.,sweet
He's as [MASK] as gall at your desertion and its consequences: don't expect thanks for this noble devotion.,bitter
The bulls-eye is near as [MASK] as a chipmunk and don't move.,big
"But despite all the backstage drama, the show still churned out sketches that made us laugh hard and others that were as [MASK] as grandma's Christmas fruitcake.",sweet
"better than a good many, for I am as [MASK] as a lion, and all men ain't.",strong
"ffor the space of half a year, the gunpowder lay as [MASK] as sand, because no fire came near to explode it.",harmless
One thing stood out after that day of feeding countless rounds through those UZIs - they were as [MASK] as a brick.,reliable
"As I am as [MASK] as a giraffe, the hump makes longer trips uncomfortable.",tall
"The ""to grease or not to grease square taper"" debate is probably as [MASK] as time itself.",old
"But when Grandma spread out the chicken and sandwiches and cookies and lemonade in the shade of the big tree, they found that they were as [MASK] as bears.",hungry
"Her thin calico dress was soaked with the damp in the air, and she was shivering and looked as [MASK] as a sheet.",white
"She was rather thin, but young, and fresh-complexioned, and her eyes sparkled as [MASK] as diamonds.",bright
"The boat received major dents and scratches, it seems as the material is as [MASK] as butter.",soft
"I need not expatiate on the usefulness of that valuable species of cattle, which might have been as [MASK] as asses before now, if our lawgivers had been as mindful of their duty in the suppression of jockey-ship, as they have been in the suppression of usury.",cheap
"He's still as [MASK] as an ox,  Barbara interjected.",strong
When our eyes met he went on with his mouth scarcely leaving hers it was as [MASK] as a sword through a chink in a suit of armour.,piercing
And after being out in the sunshine with the children most of the day she'd lost her pale city complexion becoming as [MASK] as a berry and looking much younger.,brown
At last she reached a wall waist - high stone - built below which stretched the shore as [MASK] as a seashell in the moonlight.,pale
Well you are still as [MASK] as a reed coltish I believe your father used to say you still have the same intriguing green eyes and those slanting eyebrows.,thin
She pushed back her hair as [MASK] as copper in the sunshine that slanted through the big bay window.,bright
With a brief mocking smile he turned away and hurried up the steps to the hotel lobby his back was as [MASK] as a roll of barbed wire.,hostile
The rush-hour traffic in the city centre had been as [MASK] as a plate of home-made porridge.,thick
Her voice was as [MASK] as a rock and she met his silvery-green eyes without flinching.,steady
Francesca was as [MASK] as a picture and apparently glowing with health.,pretty
Ruth was as [MASK] as a dolphin in the water and she was away from him before he had a chance to stop her.,agile
Did I accuse you of being as [MASK] as nails he teased gently at last as if reading her mind.,hard
The picturesque village seems as [MASK] as the series at first sight.,surreal
The gulf in class was as [MASK] as the Mersey after the break but the first-half belonged to Sunderland.,big
This work with great and powerful climaxes in first and last movements with a scherzo which is as [MASK] as thistledown a truly poetic slow movement and tremendous pageantry in the finale is much more than a series of vignettes of a great city.,light
SUSAN Finley had to be as [MASK] as nails to secure a top job aboard a luxury cruise liner.,tough
I haven't been on the stage for a long time so I'm bound to be as [MASK] as a kitten before I go on.,nervous
It has often been claimed that English speech is rhythmical and that the rhythm is detectable in the regular occurrence of stressed syllables of course it is not suggested that the timing is as [MASK] as a clock the regularity of occurrence is only relative.,regular
Everywhere there is delicious coffee served very strong and black in little cups it is either free or costs about 2p and seems as [MASK] as water here.,common
George was a quick thinker so always did the introducing and all of the talking but George did not talk about himself he told of how Lennie was as [MASK] as a bull and how he could buck barley all day.,strong
Moreover he was chuckling and making humorous observations to Fleury in Hindustani his eyes gleaming as [MASK] as anthracite pointing at his neck occasionally and shaking his head as if over an unusually successful jest.,black
Writing of the work of Chardin whose most profoundly moving paintings are revelations of how trivial homely everyday scenes and objects are transformed for us when we see them through the eyes of a great painter Proust says Chardin has taught us that a pear is as [MASK] as a woman a kitchen crock as beautiful as an emerald.,living
Though you may wish to insist it is not true the fact remains that Leos are as [MASK] as the stains on a butcher's tunic.,stubborn
The sparrows alone with their urchin adaptability have found their snow legs and know already that today the street-bottoms are as [MASK] as the air and that they run no danger from dog or bicycle.,safe
People said that she was as [MASK] as the Moor itself and just as changeable.,wild
"One moment she could be smiling tenderly as she fed the animals, the next filled with anger and as [MASK] as a tiger at bay.",dangerous
She had been as [MASK] as a feather to carry and her small hands were as cold as ice.,light
The even strength of his fingers and his robust eloquence James Huneker would never have found the Scherzo from the B minor Sonata which is as [MASK] as a harebell after this and assurance are often awe-inspiring few young pianists have found a more direct path to musical truth or heeded Jorge Bolet's adage that speed is so often the enemy of excitement.,light
All this may be for the locals but in Cologne you'll find the welcome extended to visitors is as [MASK] as a schnapps downed in one.,warm
The other friend who also decided to become a lawyer was as [MASK] as an arrow in flight and in total contrast was very conventional in his approach to life.,straight
The thousands of groups and organisations are as [MASK] as the colours of the rainbow and they have taken this natural phenomenon as the New Age symbol.,diverse
The pun on Spinoza was too good for Coleridge to resist and the remarkable nose he attributed to Walsh may well have been borrowed from his memories of the innkeeper at the Castle of Comfort on the road from Stowey to Holford his nose which was locally famous was said to be as [MASK] as a fist and well warted.,big
Although the mind-body effects of essences can be verified by science the spiritual dimension is of course elusive as [MASK] as the fragrance of a beautiful flower.,celestial
She was as [MASK] as a ghost and her eyes were shadowed as if she had n't slept properly for weeks.,white
Penelope Fitzgerald's prose is as [MASK] as glass and you realise how much she hasn't said only when you stop laughing.,clear
But Thomas Carter was from Philadelphia and his love for Oxford and for England was a pure boyish enthusiasm which is as [MASK] as a passion for preserved railways or real ale.,innocent
With the upstart Parsons that margin was as [MASK] as a motorway of course but even Thomas Carter Nature's gentleman couldn't help getting it ever so slightly wrong in his case by bending over backwards to minimize his achievements and rubbish his accomplishments in order to spare you the painful comparison with your own lacklustre status.,wide
Sir John Anderson who had much to do with atomic weapons development said he was as [MASK] as the flames of Hell.,red
His brain becomes as [MASK] as cheese.,soft
"At a time when spare tax dollars are as [MASK] as cougars in Ontario, the commissioner is concerned that it's a sign the government doesn't intend to do much on the ground.",rare
"Her cousin had shrunk into a corner of the settle, as [MASK] as a mouse, congratulating himself, I dare say, that the correction had alighted on another than him.",quiet
"He can sow an idea, which is as [MASK] as gunshots or close-hand combat, which he s masterful in.",powerful
"As soon as I figured out that one of my life goals is to support people and make them feel good, I automatically felt as [MASK] as a lion!",brave
"The perfect pair of old beaten-up jeans look pretty badass and what's more, they're about as [MASK] as a pair of sweats.",comfortable
"And sliding from the bed before I could hinder her, she crossed the room, walking very uncertainly, threw it back, and bent out, careless of the frosty air that cut about her shoulders as [MASK] as a knife.",keen
"Some types are as [MASK] as a thumb, and yet can flying hundreds of miles over land and sea to migrate each year.",small
"as he spoke he smiled, and the lamplight fell on a hardlooking mouth, with very red lips and sharp-looking teeth, which is as [MASK] as ivory.",white
Our darling girl is as [MASK] as sugar and has a face that you can not resist.,sweet
"We are portrayed as [MASK] as steel, to a not small degree because the eyes of humans can not see our color and see us only as gray, steel gray.",cold
she was not at all shy but she was as [MASK] as a flower.,sensitive
"The goal may be the same for most people who work with a debt consolidation agency, but someone's financial situation and needs can be as [MASK] as a fingerprint in my opinion.",unique
"Although I said earlier, with Venus in that house of office and work atmosphere, your relationship with co-workers will likely be as [MASK] as silk, in all the days near February 26, you do have to be careful about what you say, or how you say it, lest someone overreacts by having a meltdown.",smooth
"By the time I started paddling through Lilypad, the overcast had completely burnt off and the wind had died, leaving the water as [MASK] as glass.",smooth
"All you need is a 10-minute nap and voila, a slurp of rose wine and I feel as [MASK] as a daisy ... What I like in being drunk is the moment when you're alive and enthusiastic.",fresh
"Mold can be just as [MASK] as bugs, and can be contagious between plants in the same room, and even the same house!",annoying
"The colour of the water, as seen at some distance, was like that of a river which has flowed through a red clay district, but under the shade of the vessel's side it was quite as [MASK] as chocolate.",dark
"Hours, incidentally, are as [MASK] as salary and responsibility: it will be your job to hammer out an arrangement that satisfies your needs.",variable
"Before the financial crash in 2008, UK banks were considered to be as [MASK] as a rock.",stable
"I normally find Dev Patel as [MASK] as a bunch of rocks, but here he gives a rich and soulful turn as a man who just wants his creation to be a good man / robot, and will stop at nothing to engage Chappie's morality.",bland
"The cyst, which can be as [MASK] as a nut or as large as a grapefruit, can be removed by surgery, allowing the baby to develop normally.",small
"A one-sided argument is just as [MASK] as a story with holes in itin fact, they're one and the same.",bad
"sorry I made you stutter On May 31, 2017 at 8:52 am, Matthew says: Since you're about as [MASK] as a brick, I'll explain it to you.",dense
The descriptions of landscapes are as [MASK] as loam.,rich
"she could only flounder gracelessly up to her elbows, her backbone as [MASK] as a noodle.",limp
Most people assume German cars are as [MASK] as the sun rising and French cars - as flaky as a croissant.,reliable
"We all kept as [MASK] as mice a full half-hour, and should have done so longer, only Joseph, having finished his chapter, got up and said that he must rouse the master for prayers and bed.",mute
"If I could have that, along with a little AJAX support, I'd be as [MASK] as a lark.",happy
since his last words he had remained as [MASK] as a tomb.,silent
The continual passage from one to the other was initially as [MASK] as a succession of hot and cold showers and ultimately as enervating.,refreshing
But like medicine it did him good and the food tasted better than it looked and after a while the silence grew less tense and they began to chat about the contrast between bloody - minded earnest Perugia just visible on its wind - swept ridge as a distant smudge of grey and Assisi symbol of everything nice and pretty and kind whose pink stone made even its fortifications look as [MASK] as an illustration in a book of fairy tales.,innocent
Great creatures roamed the forest some like bears others like cattle reaching up on hind legs that were as [MASK] as oaks to chew leaves and berries from the tops of the trees.,thick
The tentacles went momentarily as [MASK] as rods hurling their various cargoes around the room before bunching up protectively in front of the abused Eye.,stiff
She smiled a small smile as [MASK] as rue that just curled the corners of her lips.,bitter
The Welsh wanted none but valuable prisoners and had no interest in killing the others since they would surely leave this place more nimbly and rapidly than the English survivors and be as [MASK] as the stars by the time another force looked for them.,inaccessible
In Darcy's Utopia money will be as [MASK] as coconuts in a country where they fall from the trees it will cease to be a corrupting cause.,meaningless
And I listen at the wall for sounds from Jancey but it's as [MASK] as a pillow and she's obviously gone to bed.,quiet
He was as free and as [MASK] as a bird as he made sure to tell her and they clearly got along well.,single
Meredith he said quietly his voice which was as [MASK] as silk your father ordered that his possessions should be burnt.,soft
My hand was as [MASK] as a football and throbbed with a pain that extended to the shoulder blade.,large
Her skin was as [MASK] as milk her eyes were green flecked with amber and rather slanted.,white
And added my own selfish after-thought that the whores in Paris were the most skilled in the world whilst cups of claret were as [MASK] as water there.,cheap
The African is as [MASK] as a ploughox each man can do the work in this clime of two or three of men like us.,strong
Jealousy he thought was as [MASK] as fear the same dryness of the mouth the thudding heart the restlessness which destroyed appetite and peace.,physical
This trowel is every bit as [MASK] as a knife or bayonet and will easily prize up any large stones I have done this often even in rock-hard clay.,strong
My face was as [MASK] as a tomato as I was shown to my seat.,red
The sheets seemed as [MASK] as blankets and Flit was the only thing that prevented the mosquitoes descending on us like vultures.,light
We had no means of communication with the people in the mountains which to us were as [MASK] as Tibet and the doctor had not ventured there again in fact he was now in great danger.,remote
In spite of all this food I remained as [MASK] as a rake and was as hungry as ever.,thin
His voice had been as [MASK] as the whisper of a breeze against silk.,faint
Susan's face was as [MASK] as snow and she was shaking with cold.,white
One would be the version to be found in the published research papers those strange constrained pieces of writing whose conventions are as [MASK] as a sonnet whose scientific account is always a set of clearly designed unambiguously conducted and conclusive observations building from earlier data and in their final paragraphs pointing the way to future experiments more research is needed to.,rigid
His eyelashes were extravagantly long tar black and as [MASK] as the teeth on a comb and his lids were gently slanted harbouring eyes of an electrifying blue.,thick
We suddenly realized that we were as [MASK] as air and could n't think of a thing to do with this unexpected liberty.,free
"This recipe is as [MASK] as a pair of jeans and, we suppose, could be doctored with a handful of chocolate chips or shredded coconut, but why mess with perfection?",basic
"If a business is centered around your individual talents, the need for good time management should be as [MASK] as a slap in the face.",obvious
"When the two armies clashed the arrows flew in such clouds that they darkened the sky, the hooves of the chariot horses were like thunder upon Olympus, the brazen armour of the Atlanteans dazzled the eye and their spearheads seemed as [MASK] as wheat growing in a field.",countless
"This new moon will arrive with Jupiter in close alignment, which is as [MASK] as diamonds.",rare
"However, fibroids can grow to be as [MASK] as a melon and when they get this big they can cause a lot of pain and discomfort for the female.",big
His eyes are as [MASK] as fire from weeping.,red
The sky was overcast and as there was no wind the lake was as [MASK] as glass.,smooth
"When it comes to women in real life, I imagine he 's as [MASK] as a sheep.",gentle
"Our last glimpse of her shows her at the window, watching them receding into the sky until they were as [MASK] as stars.",small
"They were approximately four kilometers away from the enemies, and the fire torches were about as [MASK] as a firefly, and it was quite impossible for them to even see the figure carrying the torches.",bright
"The creatures can reach an impressive 5,000 pounds and their thick skin is as [MASK] as rubber.",tough
"but he was as [MASK] as a mule, and, instead of snatching at her bait, in wet weather he took to smoking with Joseph.",stubborn
There's no danger he translated his eyes on the soothsayer's hands but the boar that we want is as [MASK] as the wind and as sharp as an eagle.,fast
Lola kept track of patients whose personalities were as [MASK] as the weather One minute Paul says he does not want his wife any more and the next he has changed his mind she listened to their grievances Josef thinks he is fit to work and look after himself says he is being kept a prisoner but he is very confused and deluded and even mediated between doctors Dr Freymann said it must be a genuine case of epilepsy but.,variable
Her back was as [MASK] as a ramrod which made her feel a little more dignified while engaging in what she considered the unladylike art of cycling.,straight
The derelict remains of the old building were as [MASK] as the weather and the bare trees dripped with melting frost like chilling tears.,bleak
When he went to look at Anna before going to school her eyes were once more as [MASK] as the sky and she curled her fingers round his as if she didn't want to let him go.,blue
Sarah stayed outside a few minutes longer her spirits lifting wondrously and she felt as [MASK] as a robin singing among the branches of the oak tree.,happy
When the sun played on her golden hair it was as [MASK] as the copper warming pan which Sarah put between the sheets on winter nights.,bright
When he was no more than knee high and as [MASK] as a pencil I dug him out of the wild river bank and planted him in a virginal garden half an acre of island that consisted of nothing more luxurious or exotic than brick rubble tilled chalk and grass seed.,slender
He made himself as [MASK] as a lamb hoping perhaps that they would give him an extra morsel of food or some other favour.,modest
The sense of disappointment was as [MASK] as a blow painful out of all proportion so much so that for a moment I was almost angry with him for not being there.,sharp
You must be as [MASK] as the reed in the fable lest by resisting the tempest like the oak you be torn up by the roots.,flexible
Her body went as [MASK] as a bowstring and when she opened her eyes and looked into his face she saw there awestricken astonishment.,tense
He felt as [MASK] as a kitten but the fever and nausea were gone.,weak
The big wooden table had been scrubbed as [MASK] as a bone on the seashore.,white
From then on his manner towards me was as [MASK] as ice which caused me great pain.,cold
The bell-lamp in the passage looked as [MASK] as a soap-bubble you could see yourself in all the tables and French-polish yourself on any one of the chairs.,clear
The sweater was as [MASK] as a puff and as smooth as a bird to touch.,light
The nine Women came behind her their footfalls as [MASK] as birds'.,light
Lieutenant Webster the Duke's voice was as [MASK] as a sword in winter four horses instantly to the Prince of Orange's carriage.,cold
On the other hand he had to be as [MASK] as granite inside harder even than a brutally flamboyant exhibitionist such as Obispal since Jaq was a guardian of those who guarded humanity an investigator of the investigators.,hard
They held each other soberly and Anna noticed he was as [MASK] as a ruler all bone.,thin
It was not surprising that Benny had been as [MASK] as a hen walking on hot coals all summer long never able to keep still always jumping up with some further excitement.,excited
To the Romanian audience for these trials which were broadcast live on television the lists of cartons of cigarettes or kilos of refrigerated meat were as [MASK] as the tales of the riches of the Sultan in One Thousand and One Nights.,fascinating
I wanted to express what a simple thing death and burial is just as [MASK] as the falling of a leaf - just a bit of earth dug up a wooden cross.,simple
During our set the sky grew gradually darker and darker until by the last number the sky was as [MASK] as the ceiling of the Camden Falcon.,black
Levy's voice is as [MASK] as a shag on the floor of a sandpaper factory the lyric is utterly ridiculous describing the popularity and stylishness of a certain fashionable item and the soprano sax added to that tender little guitar lick from the Arrested Development record just upsets your soul.,rough
For emotional resonance flags are about as [MASK] as a quadrilateral of cloth can be.,potent
Don't call me that you great jerk said Perdita hammering her fists against his chest which was as [MASK] as the ground outside.,hard
When Mr Wormwood arrived back from the garage that evening his face was as [MASK] as a thunder-cloud and somebody was clearly for the high-jump pretty soon.,dark
Plus they rely far too heavily on Chad Gracey's bionic drumming to get them noticed the tinny snare effect soon becoming as [MASK] as a catfight underneath your window at 3 am.,annoying
Thin and tiny in stature her back was as [MASK] as an arrow but her legs often pained her in the cooler winter and spring weather.,straight
He sat back as [MASK] as a cat that has licked the cream while Eleanor held his hand and looked concerned.,smug
We can hardly tell the Finance and Executive Committee that the British are unreliable at the vehicle plants but as [MASK] as the Rock of Gibraltar when it comes to components.,solid
