masked sentence,expected
Ken was as [MASK] as a lion. He saved the girl from drowning.,brave
The feather of the swan is as [MASK] as snow.,white
The student was as [MASK] as a cucumber as she gave her speech.,cool
jane can easily lift the box. It is as [MASK] as feather.,light
"Despite eating an entire bag of Halloween candy, Mary was still as [MASK] as a rail.",thin
the table is as [MASK] as rock.,solid
The thief was as [MASK] as a fox because he managed to escape from the police.,cunning
My little sister is a spoil brat. She is as [MASK] as a mule.,stubborn
My mom is as [MASK] as a mouse. she never raises her voice.,quiet
wow the chocolate is as [MASK] as sugar.,sweet
I promise I won't wake you up when I get home. I will be as [MASK] as a mouse.,quiet
The street was as [MASK] as an oven.,hot
James' mother was as [MASK] as a peacock when he became a doctor.,proud
The boy danced as [MASK] as a swan for the concert.,graceful
"School is over, so I'm now as [MASK] as a bird.",free
"When I woke up this morning, my house was as [MASK] as ice.",cold
The girls could see the fish swimming in the river because the water was as [MASK] as crystal.,clear
His heart is as [MASK] as an ice.,cold
The judge is as [MASK] as an owl.,wise
The motion sickness hit the sailor as [MASK] as lightning.,fast
the beggar was as [MASK] as a wolf and ate up the food very quickly.,hungry
The boy ate five plates of fried noodles because he was as [MASK] as a bear.,hungry
Our pillows are as [MASK] as clouds.,soft
The judge was as [MASK] as an owl because he made a great decision.,wise
His heart is as [MASK] as lead. There simply is no alternative for him.,heavy
The young boy was as [MASK] as a lion during his doctor's appointment.,brave
The air felt as [MASK] as lava.,hot
The sky was as [MASK] as ink.,black
The poor child ate three bowls of rice just now. He is as [MASK] as a wolf.,hungry 
"Though the athlete is in his forties, he is still as [MASK] as monkey.",agile
"Our headmaster, Mr Chan was as [MASK] as a lion when he was scolding his pupils for playing truant.",fierce
Mr. Jenkin's hat was as [MASK] as a pancake after I sat on it.,flat
"She did not want to wake her baby up, so she was as [MASK] as a mouse when she opened the door.",quiet
Ali needs to do five jobs in a day. He is always as [MASK] as a bee.,busy
Her skin was as [MASK] as snow.,white
I have so many things to do right now. I am as [MASK] as a bee.,busy
the newborn rabbit's fur was as [MASK] as snow.,white
The car crash was as [MASK] as thunder.,loud
My little sister is as [MASK] as a mouse. She does n't like to watch horror movie.,shy
Sarah's hands were as [MASK] as ice walking in the snow.,cold
The sea is as [MASK] as a crystal. We can see the fishes swimming around the coral.,clear
The chef is as [MASK] as a bee. He is preparing 200 bowls of noodles for the hotel guests.,busy
Mariatu was as [MASK] as a mouse as she snuck into her sister's room.,quiet 
People who are as [MASK] as a bear may break the glasses and plates in the shop.,clumsy
your skin is as [MASK] as silk.,smooth
her eyes were as [MASK] as coal.,black
The tea that we drank just now was as [MASK] as honey. So we had to add in some plain water.,sweet
Nobody likes Lisa because she is as [MASK] as a peacock. She always boasts about how rich her parents are.,proud
The man is as [MASK] as an ox. He can lift a table with only one hand.,strong
My friends and I sold bookmarks and donated the money to an old man who was as [MASK] as a church mouse.,poor 
My brother was as [MASK] as a lark when he got straight A's in UPSR.,happy
Maria is a kind girl. She brings happiness to everybody. She is as [MASK] as pie.,sweet
He ran as [MASK] as lightning home when it started to rain.,quick 
Her heart is as [MASK] as water.,pure
Fairus is as [MASK] as a bear. He is always breaking things.,clumsy
His scream was as [MASK] as thunder when he hit his leg against the wall.,loud 
"please be careful, the floor is as [MASK] as eel.",slippery
The cat was as [MASK] as cheetah.,fast 
everyone who sat on that bench complained that it was as [MASK] as a rock.,hard 
I hardly see my father these days as he is as [MASK] as a bee.,busy
my computer is as [MASK] as a snail. i'm afraid i'll have to buy a new one soon.,slow
The cooing baby was just as [MASK] as a kitten!,cute 
Mother advised my sister not to be as [MASK] as a peacock because she is very beautiful.,proud 
The thief is as [MASK] as a fox.,cunning
"After swimming 20 laps, William was as [MASK] as a bear that had recently awakened from hibernation.",hungry
Mina is as [MASK] as death ecause she is not feeling well.,pale
The waxed floor was as [MASK] as an ice rink.,slippery
the stuffed animal was as [MASK] as cloud.,soft
"In the days before Christmas, the kids were as [MASK] as candy, hoping to end up on Santa's good list.",sweet 
my dog's fur is as [MASK] as cloud.,soft 
The guards in front of the palace gate barely moved. They stood as [MASK] as a statue.,still 
Ali is sick and he is resting in his bed. His face is as [MASK] as a sheet.,pale 
Loshini was as [MASK] as a cucumber when the boys teased her.,cool
The girl was as [MASK] as a bat without her glasses.,blind
The knives in the drawer are as [MASK] as a razor.,sharp
He drew a line as [MASK] as an arrow.,straight
She is as [MASK] as a blue whale.,smart
Tonya is as [MASK] as sugar.,sweet
She was as [MASK] as a toothpick.,thin
"Although Kai Ren and his twin brother look as [MASK] as two peas, their characters are different.",alike
He is as [MASK] as a cat.,lazy
The woman was as [MASK] as a puppy.,fluffy
He is as [MASK] as a Gorilla.,hairy
this fruit is as [MASK] as honey.,sweet
Abu is as [MASK] as a mouse because he is afraid of everything.,shy
He is as [MASK] as a stick.,thin
Her hair was as [MASK] as silk.,soft
this boy is as [MASK] as a turtle.,slow
He was as [MASK] as a cucumber.,cool
His hair was as [MASK] as a basket of oranges.,bright
Casey is as [MASK] as a cupcake.,sweet
Sara was as [MASK] as a lamb.,gentle
Please help him. He can't see anything without his glasses. He is as [MASK] as a bat.,blind
that tallest girl in our class is as [MASK] as a giraffe.,tall
The lemon juice was as [MASK] as vinegar so Jimmy added some sugar.,sour
The car is as [MASK] as a cherry.,red
Freshly washed sheets are as [MASK] as untouched water.,smooth
"Her lines of poetry are as [MASK] as flowers, as strong as vines.",sweet
The cat is as [MASK] as the night sky.,black
the surface of the stool was as [MASK] as rock.,hard 
The handshake felt as [MASK] as her mother's laundry.,warm
She is as [MASK] as a May morning.,tender
the coins were shinning as [MASK] as sun.,bright
Bowen is as [MASK] as a dragon.,mean
The snow was as [MASK] as a blanket.,thick
The boy's hat was as [MASK] as the grass.,green
The bread was as [MASK] as nails.,hard 
Their words were as [MASK] as knives.,harsh
The baby cried as [MASK] as train.,loud
His character was as [MASK] as brick.,solid
Ian is as [MASK] as the Empire State Building.,tall
Salman is as [MASK] as death after seeing the phython.,pale
My dog is as [MASK] as dirty socks.,foul
You seem to have many antique stuffs in the cupboard. They must be as [MASK] as the sun.,ancient
The frog was as [MASK] as oil.,slick
Manny's made a bookshelf that is as [MASK] as a puppy's fur.,smooth
I start to chop off a potato's end which is as [MASK] as a thumbnail.,wide
She sang as [MASK] as a screaming baby.,loud
Caitlin's smile was as [MASK] as the sea.,wide
My Grandma is as [MASK] as the hills.,old
I'm as [MASK] as a bat without my glasses.,blind
The brook gurgled as [MASK] as a well-fed baby.,old
his promise is as [MASK] as gold. we can rely on him.,good
He is as [MASK] as a barrel of monkeys.,funny
That baby is as [MASK] as a kitten.,cute 
The water well is as [MASK] as a bone.,dry
I was as [MASK] as a kid at a birthday party.,happy
He is as [MASK] as a mouse.,quiet 
My grandfather is eighty years old but he is still as [MASK] as a fiddle. He exercises daily at the park.,fit
I think my grandfather is as [MASK] as these hills!,old
Leah looked as [MASK] as a ghost yesterday.,pale
my grandma is as [MASK] as an owl.,wise
he is as [MASK] as a mouse.,silent 
Mrs Max bought a new blouse and it felt as [MASK] as silk.,smooth
He was as [MASK] as a bat.,blind 
She was as [MASK] as a lion.,brave
You're as [MASK] as a button!,cute 
She was as [MASK] as a bee.,busy
his neck is as [MASK] as giraffe.,long
My hands were as [MASK] as ice.,cold
Sally is as [MASK] as pie.,sweet
He was as [MASK] as pie.,sweet 
The house was as [MASK] as a mouse.,quiet 
Fatoumata is as [MASK] as honey!,sweet
"Ever since he started practising 'tai chi', Mr Tan has been as [MASK] as a fiddle.",fit
The old man was as [MASK] as a bat.,blind
Toa is as [MASK] as a strong chicken.,brave
The traffic is moving as [MASK] as a snail at the toll plaza.,slow
She is as [MASK] as a fiddle because she exercises every day.,fit
The baby was as [MASK] as a picture.,pretty
The old man walks as [MASK] as a snail.,slow
My sister was as [MASK] as a bee preparing for her ballet performance tomorrow. She had a lot to practice.,busy
the child is as [MASK] as a kitten.,playful
The little baby was as [MASK] as candy.,sweet
there was no more water in the lake. it was as [MASK] as bone.,dry
Kozmy is as [MASK] as gold.,good
she woke in the morning as [MASK] as daisy.,fresh
"Look at him, he has recovered from a fever and looks as [MASK] as day.",new
my grandmother is as [MASK] as honey.,sweet
the man is as [MASK] as a mule.,stubborn 
Mr wong is as [MASK] as lion.,brave
she is as [MASK] as a lamb.,gentle
Jason is as [MASK] as an owl.,wise
Mr. Ray is as [MASK] as a cheetah.,fast
she was as [MASK] as a feather.,light
Mrs. Cole was reading a book which is as [MASK] as an elephant.,big
my mother is as [MASK] as a bee.,busy
Kamal can climb up and down easily and quickly. He is as [MASK] as a monkey.,agile
The pencil is as [MASK] as a feather.,light
The paper is as [MASK] as a feather.,light
harry is as [MASK] as an ox.,strong
He is as [MASK] as a rail.,thin
This house is as [MASK] as a whistle.,clean
Her mom is as [MASK] as sugar.,sweet
He is as [MASK] as a lion.,brave
She is as [MASK] as a toothpick.,tooth
They are as [MASK] as night and day.,different
The fire was as [MASK] as a crackling fire.,warm
"nora won't change her decision, she is as [MASK] as a mule.",stubborn 
my hands are as [MASK] as ice.,cold
my throat is as [MASK] as a bone.,dry
the warrior is as [MASK] as a lion.,brave
"Without my glasses, I am as [MASK] as a bat.",blind
my sister is as [MASK] as sugar.,sweet
I am as [MASK] as a wolf I can finish all the food.,hungry
My best friend is as [MASK] as a dog.,loyal
the sunset at the beach is as [MASK] as rainbow.,beautiful
The children were as [MASK] as mice.,quiet
he is as [MASK] as ox.,strong
You were as [MASK] as a lion.,brave
Ted was as [MASK] as a cat with a long tail in a room full of rocking chairs.,nervous
"Without his spectacles, my grandfather is as [MASK] as a bat.",blind
Mazlan is as [MASK] as a bat without his eyeglasses.,blind
Her hair is as [MASK] as silk.,smooth
"Without his glasses, the man was as [MASK] as a bat.",blind
She is as [MASK] as a swan.,graceful
She was as [MASK] as a bee.,busy
Abigail is as [MASK] as a giraffe.,tall
This book is as [MASK] as a feather.,light
"Since Mom has two jobs, she is always as [MASK] as a bee.",busy
My new baby brother is as [MASK] as a button.,cute 
"In her new dress, Paisley was as [MASK] as a button.",cute 
The instructions were as [MASK] as mud.,clear
The dog was as [MASK] as an elephant.,big
the room was as [MASK] as night so i couldn't see anything.,dark
He is as [MASK] as a barrel of monkeys.,funny
"Without my glasses, I'm as [MASK] as a bat.",blind
"She has learned gymnastics, and is as [MASK] as a monkey.",agile
He is as [MASK] as a giraffe.,tall
She is as [MASK] as a tack.,sharp
robin can run as [MASK] as cheetah.,fast
You are as [MASK] as a lion.,brave
the laundry bag was as [MASK] as elephant.,big
The pencil is as [MASK] as a feather.,light
I slept as [MASK] as a bug in a rug in my new bed.,close
The dinner was as [MASK] as a five star restaurant.,declious 
He was as [MASK] as a beaver.,busy
My dog is as [MASK] as a mouse.,quiet
He is as [MASK] as a skyscraper.,tall
I am so thirsty that my throat is as [MASK] as a bone.,dry
That was as [MASK] as a haunted house.,scary
The ballerina is as [MASK] as a swan.,graceful
Bill was as [MASK] as a snail.,slow
david runs as [MASK] as snail.,slow
I am as [MASK] as a bear recently awaken from hibernation.,hungry
This bagel is as [MASK] as a rock.,hard
Her smile is as [MASK] as the sun.,bright
the boy is as [MASK] as giraffe.,tall 
The bruise on George's foot felt as [MASK] as an elephant.,big
The student was as [MASK] as a bee.,busy
john runs as [MASK] as a cheetah.,fast
She is a ballet dancer who can dance as [MASK] as a swan.,graceful
"Although my grandfather is already 70 years old, he is still as [MASK] as a fiddle.",fit 
The test is as [MASK] as ABC.,easy
He is as [MASK] as a fox.,quick
You can be as [MASK] as a dog.,happy
The bread was as [MASK] as a rock.,hard
"You know how in ""Rocky"" he prepares for the fight by punching sides of raw beef? Well, yesterday it was as [MASK] as that meat locker he was in.",cold
The night is as [MASK] as a sharp sword.,cold
She was as [MASK] as a button.,cute
alia always falls down. she is as [MASK] as a bear.,clumsy
He is as [MASK] as a fox.,sly
John is as [MASK] as a horse.,hungry
The dog was as [MASK] as coal.,black
he is as [MASK] as a feather.,light
Zane could answer all the questions during the examination because they were as [MASK] as ABC.,easy
She is as [MASK] as a picture.,pretty
The football player is as [MASK] as a cheetah.,fast
Johnny was as [MASK] as lightning.,fast
He can't see anything without his glasses. He is as [MASK] as a bat.,blind
Learning to bake a cake is as [MASK] as ABC.,easy
The candy is as [MASK] as a rock.,hard
The twins Peter and Jason are as [MASK] as two peas They are twins.,alike
He was as [MASK] as a duck.,lame
The bruise on George's foot felt as [MASK] as the ocean.,blue
They are as [MASK] as night and day.,different
That car is as [MASK] as a cherry.,red
The English teacher's explanation was as [MASK] as mud.,clear
the exam was as [MASK] as a piece of cake.,easy
He is as [MASK] as a fox.,smart
I'm as [MASK] as a bear that just work up from its winter sleep.,hungry
The band played as [MASK] as a sonic boom.,loud
The boy was as [MASK] as lightning in the race.,fast
My new baby brother is as [MASK] as a button.,cute
The directions were as [MASK] as mud.,clear
That explanation was as [MASK] as mud.,clear
today reena is as [MASK] as a bee.,busy
"After Christian's ball was run over by the car, it was as [MASK] as a pancake.",flat
She is as [MASK] as a picture.,pretty
The room is as [MASK] as night so I could not see anything.,dark
That box is as [MASK] as a feather.,light
The lake was as [MASK] as glass.,clear
i am as [MASK] as a cheetah.,fast
Maria was as [MASK] as a swan.,graceful
Have you ever felt as [MASK] as a hippo?,hungry
the baby rabbit was as [MASK] as mouse.,small
She was as [MASK] as ice.,cold
Your explanation is as [MASK] as mud.,clear
The children were as [MASK] as gold. The teacher was very pleased with them.,good
The children were as [MASK] as a mouse.,quiet
Jerwin is as [MASK] as a lion.,brave
sue is as [MASK] as a picture.,pretty
She is as [MASK] as a bee.,busy
My grandfather is as [MASK] as a bat without his glasses.,blind
my house is as [MASK] as a star.,clean
"Without his glasses, the man was as [MASK] as a bat.",blind
His explanation was as [MASK] as mud.,clear
We are as [MASK] as two peas in a pod.,alike
The little boy stood as [MASK] as a soldier.,still
Jim felt as [MASK] as an owl when he got his test back.,wise
The successful businesswoman is as [MASK] as a peacock. Her new collaboration with an international company in London.,proud
he was as [MASK] as a mouse when he crept into the room.,quiet
Kim's tongue felt as [MASK] as a bone.,dry
She is as [MASK] as a fox.,cunning
My dad is as [MASK] as a bee.,busy
She is as [MASK] as a kitten.,cute
This bagel is as [MASK] as a rock.,hard
Jayden was as [MASK] as a wet hen.,mad
My grandma says I am as [MASK] as pie.,sweet
The class was as [MASK] as a mouse.,quiet
jack is really tall. he is as [MASK] as a mountain.,tall 
The water was as [MASK] as crystal.,clear
The car was as [MASK] as a cheetah.,fast
The cookies were so overcooked that they were as [MASK] as rocks.,hard
Usain Bolt runs as [MASK] as a cheetah.,fast
She was as [MASK] as a button.,bright
Her hair is as [MASK] as coal.,black
I'm feeling as [MASK] as a dog.,sick
He was as [MASK] as a cucumber.,cool
I am as [MASK] as a bear.,hungry
Dona's vision was as [MASK] as a hawk's.,sharp
My dad is as [MASK] as an ox.,strong
She is as [MASK] as candy.,sweet
The bruise on Jack's foot felt as [MASK] as an elephant.,big
My grandpa is as [MASK] as an owl.,wise
Your smile is as [MASK] as the sun.,bright
His mind is as [MASK] as a samurai's sword.,sharp
That student was as [MASK] as sugar.,sweet
He is as [MASK] as a rail.,thin
I'm as [MASK] as a wolf.,hungry
That trip was as [MASK] as a cheetah.,fast
Her hair is as [MASK] as coal.,black
They are as [MASK] as two peas in a pod.,alike
She is as [MASK] as a mouse.,quiet
He is as [MASK] as a fox.,smart
The house is as [MASK] as a whistle.,clean
The puppy was as [MASK] as a cheetah.,fast
He is as [MASK] as dirt.,poor 
my uncle is as [MASK] as a giraffe.,tall 
You are as [MASK] as a button.,cute
She is as [MASK] as a ghost.,pale
Boy was as [MASK] as a rocket as he sped by on his bicycle.,fast
He is as [MASK] as a bat without his glasses.,blind
That teacher was as [MASK] as dishwater.,dull
Roman is as [MASK] as an ox.,strong
I am as [MASK] as a bear!,hungry
i did not bring my spectacles so i am as [MASK] as bat.,blind
prem runs as [MASK] as lightning.,fast
My uncle is eighty-six years old but he is still as [MASK] as a fiddle. He exercises daily at the park.,fit
He is as [MASK] as a bat.,blind
That trip was as [MASK] as a cheetah.,fast
eashen laughed as [MASK] as thunder.,loud
You are as [MASK] as pie!,sweet
The servant is as [MASK] as a dog to her master.,loyal
The exam just now was as [MASK] as ABC. I finished it in just 10 minutes.,easy
She was as [MASK] as an owl.,wise
"In her new dress, the little girl was as [MASK] as a button.",cute
My sister is as [MASK] as a fiddle because she walks 10 kilometers daily.,fit
The cookies were so overcooked that they were as [MASK] as rocks.,hard
The little boy is as [MASK] as a mouse.,quiet
my brother is as [MASK] as lion.,brave
The book was as [MASK] as a rock.,hard
The water in the pond is as [MASK] as crystal.,clear
"The twins look alike, but they are as [MASK] as night and day.",different
You are as [MASK] as a cheetah!,fast
Mary was as [MASK] as pie.,sweet
Mom was as [MASK] as a kid on Christmas when she opened her vacuum cleaner.,silly
The exam was as [MASK] as ABC for Nora because she had studied hard and prepared well for it.,easy
The bread was as [MASK] as a rock!,hard
Mrs. Frindle is as [MASK] as pie!,sweet
He was as [MASK] as an animal.,wild
but she's as [MASK] as a goldfish.,harmless
It hasn't rained for months and the soil is as [MASK] as a bone.,dry
"When my great uncles drives, he is as [MASK] as a turtle.",slow
Mrs Jasprit is as [MASK] as bat without her glasses.,blind
The test was as [MASK] as ABC.,easy
the road is as [MASK] as an arrow.,straight
The little girl's hair is as [MASK] as silk.,soft
He is as [MASK] as an ox.,strong
Tanya is as [MASK] as sugar.,sweet
The exam was as [MASK] as ABC for Norita because she had studied hard and prepared well for it.,easy
My grandma is as [MASK] as sugar.,sweet
my father is as [MASK] as bee.,busy
she exercises regularly and keeps herself as [MASK] as a fiddle.,fit
The water in the pond was as [MASK] as crystal.,clear
Phineas and Ferb are as [MASK] as a CIA agent.,slippery
The dog is as [MASK] as a horse.,big
She is as [MASK] as a feather.,light
Her hands are as [MASK] as the ice.,cold
the young girl was as [MASK] as a lion.,brave
The motion sickness hit the sailor as [MASK] as lightning.,fast
The ball was as [MASK] as ice.,cold
This is in a society that believes a thought is as [MASK] as the deed.,real
"The dialogue is as [MASK] as the characters, with a lot of vernacular that is specific to a certain era in New Orleans.",colorful
That math problem was as [MASK] as A-B-C.,easy
I could answer the exam questions in less than an hour. It was as [MASK] as ABC.,easy
The car was driving as [MASK] as a snail.,slow
It's as [MASK] as ABC.,easy
I'm as [MASK] as a mouse.,quiet
Mason was as [MASK] as a cheetah on wheels.,fast
Hebe's hair is long and as [MASK] as silk.,smooth
he is as [MASK] as lion.,brave
His teeth are as [MASK] as pearls.,white
this girl is as [MASK] as snow.,white
"Allow me, it's as [MASK] as ABC.",easy
The water well is as [MASK] as a bone.,dry
Mary is as [MASK] as pie.,sweet
She's as [MASK] as a button.,cute
your hands are as [MASK] as ice.,cold
jessie swam as [MASK] as a fish.,smoothly
the living room was painted as [MASK] as snow.,white
Liam dove into the water as [MASK] as an otter.,effortlessly
Zero sat as [MASK] as a statue.,still
you were as [MASK] as a lion.,brave
The dog is as [MASK] as a horse.,big
The lady is as [MASK] as a peacock.,proud
This bus is as [MASK] as a snail. We may not be able to reach the airport on time.,slow
The day continued as [MASK] as a surfboard.,smoothly
You were as [MASK] as a lion.,brave
Gorillas are as [MASK] as stones.,patient
He is as [MASK] as a monkey.,funny
The queen's heart was as [MASK] as ice.,cold
she is as [MASK] as a snail.,slow
He is as [MASK] as his older brother.,tall 
"After the ball was run over by the car, it was as [MASK] as a pancake.",flat
He is as [MASK] as a raccoon.,wild
Your stomach is as [MASK] as an elephant.,big
The dog was as [MASK] as an elephant.,big
That math problem was as [MASK] as A-B-C.,easy
Mimi was as [MASK] as a ghost when she saw a black figure inside her bedroom.,white
My brother is as [MASK] as a pig.,stubborn 
The dogs fur was as [MASK] as coal.,black
The bruise on Cillian's foot felt as [MASK] as an elephant.,big
The contract was as [MASK] as the ground.,solid
"Unfortunately, the main character ( Andrea Sachs ) is as [MASK] as flat soda.",bland
The Cat Empire is truly an original band in a time when true originality is as [MASK] as the raw talent they possess!,scarce
"The storyline, however sparse, is as [MASK] as the mathematics-albeit quite nineteenth-century'ish in tone.",interesting
Huether's and McCance's book is as entertaining and [MASK] as a root canal.,painful
"If all his work is as [MASK] as this enchanting story, I'm hooked on MacDonald.",good
"The words of the narrator are as [MASK] as his sight, and he describes for pages and pages the dialogues and behaviours that take place during such encounters.",thorough
the day was as [MASK] as a flame of a candle.,perfect
The quality of the printing and editing is almost as [MASK] as the absurdity of the unsubstantiated claims with which the two writers fill page after page.,annoying
"Jazz and her twin, Jess, are as [MASK] as night and day.",different
Chain is as [MASK] as its weakest link.,strong
"The murder story was not as [MASK] as the glimpses into the society of the time, but the author gives you a well-rounded view of both the top and bottom segments of New York.",interesting
"Afterwards, your pieces are almost as [MASK] as sunshine.",bright
"His own death would give us the freedom to see inside his life, inside his journals where his ability to place his adventures on the page is as [MASK] as any assemblage artist that comes to mind.",fascinating
"For a brief moment, in the pulse of her flesh all Lucas Corso's previous deaths came to life, as if brought by the current of a dark, slow river whose waters were as [MASK] as varnish. ",thick
Often the explanations are as [MASK] as mud.,clear
"I think the appeal is that the stories are about things young children can relate to, and often have experience of, and the hapless sheep find the world as [MASK] as little ones often do.",surprising
"Here in the moonlight, raise your sword and dance: Edges strike notes as [MASK] as any star, Sweet crystal clarity no blood could mar, Meet me in war or love, and take this chance.",bright
"First went our fat, and after the leane, Next at our selves they draw their Skeene; Our Market being spoiled thus on the Land,  And troubles increase as [MASK] as the sand.",thick
My sister is very good in drawing. Her drawings are as [MASK] as the rainbow.,beautiful
"Mama May lived where the earth met the sky, and her house was as [MASK] as the prairie.",wide
the cricketer was as [MASK] as a cat to catch the ball.,quick
The teacher's explanation was as [MASK] as mud.,clear
The groundhog on the side of the road was as [MASK] as a doornail.,dead
The cat is as [MASK] as a tiger.,fierce
"After doing my chores, the house was as [MASK] as a whistle.",clean
Talking to him was as [MASK] as eating a hamburger with freshly painted nails.,frustrating
"I am disposed to be as [MASK] as a queen, and you try to stir me up to restlessness!",content
"numerous icebergs, some of which are as [MASK] as cathedrals, and occasionally loaded with no inconsiderable blocks of rock, would be stranded on the outlying islets.",tall
This aspect is as [MASK] as diamonds.,rare
