masked sentence,expected
Come now and let us reason together saith the Lord though your sins be as scarlet they shall be as [MASK] as snow though they be red like crimson they shall be as wool.,white
One lot are as [MASK] as gold we'll have them any day but another lot are almost more than we can cope with.,good
It is as [MASK] as a galaxy itself and may be the original material of a potential star system that never really formed says Terzian.,large
From the mini weighing as [MASK] as an amoeba or only one hundred - millionth of a kilogram kg to the supermassive with a mass one thousand million times that of the Sun they have been invoked to account for a wide range of cosmic phenomena.,little
Some regard what they do simply as a form of legitimate adult play while others take it far more seriously and see themselves as going beyond present human limitations journeying into a new galaxy of knowledge in a way which they find at least as [MASK] as the exploration of deep space.,exciting
An interferometer swung around by the Earth's rotation will synthesise a dish as [MASK] as the separation of the two telescopes.,large
I was as [MASK] as a poker and as red-hot with pain.,stiff
It was as [MASK] as a caress and Violet could only squirm.,good
Bryan Gould is as [MASK] as gold and Gerald Kaufman is a happy-go-lucky bachelor who 's still waiting for the right girl to come along.,good
They're not quite as [MASK] as an onion but have a nice bite to them.,strong
In the Bible there is be as [MASK] as snow ( Isaiah 1:18 ).,white
Rats are bigger and just as [MASK] as squirrels.,smart
"These can be as [MASK] as dancing, as useful and low impact as bicycling , or as heart-thumping as boxing.",enjoyable
"It may not be as [MASK] as JonBound, but he promises to get revenge someday ... The next patch is actually a unique one .",complete
"Moving an appliance as [MASK] as a fridge, washing machine or tumble dryer on a frequent basis to give them a good vacuum just isn't practical.",heavy
"Historically, colonialism, and now capitalism , have contributed to the demonization and trivialization of these practices as savage, paganistic, hippy dippy and about as [MASK] as a placebo - the way this is presented is like these are novel ideas that were introduced to the world thanks to good ol Edga.",useful
Makes tools that are about as [MASK] as wood.,powerful
"The Bucket Hat Functionally, it's as [MASK] as a hat that you can stash away into your back pocket for rain or shine.",simple
They're not as [MASK] as grass for high-traffic areas.,durable
"Clayton Speers, 30, had a 10-cm buck knife plunged into his neck-out of the blue, as [MASK] as rain from a cloudless sky - while he was simply questioning the 48-year-old Melton about the erratic behaviour that was troubling Sunday shoppers and diners along Bayfield Ave.",unexpected
"Hence, a man knows something, which the computer can not know and the conclusion is that a computer can not be as [MASK] as a man, even in principle.",intelligent
"Proprietary vendors try to identify customer needs using marketing departments, but there's little evidence that marketing departments are as [MASK] as customers themselves at identifying customer needs.",effective
"The idea of gathering around food is a tradition as [MASK] as time, and Ayurveda recognizes that this is not only a physical process, but also an emotional and spiritual one.",good
"A motif could be something as [MASK] as a design on a Tee shirt, or it can be a theme in writing or music.",simple
A simple card or a heartfelt note is as [MASK] as a sweater or new pair of socks.,important
"And since for the next four days you're going to be about as [MASK] as a turnip, there's not much you can do about it, he tells Swamp Thing.",dangerous
"Everybody is aware of the fact that the module Spektr is as [MASK] as a doornail, but the power shortage also paralysed another 2 huge modules, i.e. Kristall and Priroda.",dead
They may be as [MASK] as URLs in a few years.,common
It was as [MASK] as a sea-gull's egg.,large
It was as [MASK] as a block of marble.,valuable
"Silphium uses notes of frankincense, myrrh, leather and tobacco to echo silphium, a herb considered as [MASK] as gold in ancient times.",valuable
"They are not as [MASK] as curses, but are still considered minor dark magic and are therefore not taught at Hogwarts.",harmful
They were as [MASK] as night and day.,different
"The formula will be richer than a gel, but not as [MASK] as a cream.",rich
"The phenomenal geothermal wonder of those pictures stayed with me, especially a geothermal pool called Bloody Pond Hell, a pool which was as [MASK] as blood.",red
They generally are more outgoing and not as [MASK] as balls.,shy
Morrison believes that action is as [MASK] as beliefs so he is standing in the upcoming TCDSB trustee by-election in North East Scarborough.,important
"he opened the gate himself and sauntered slowly up, probably enjoying the lovely afternoon that breathed as [MASK] as summer.",soft
This active ingredient means it is just as [MASK] as a pain reliever as some over-the-counter painkillers.,effective
I got one response back that a letter from home is just as [MASK] as a package.,good
I doubt many of us can say our situation is as [MASK] as a slaves in the first century.,dire
"Seven tells him that remorse is as [MASK] as anger, and he says he knows.",unbearable
"This may be as [MASK] as writing, this happens, then this, then that, on a sheet of paper, or you might want to write some scenes or topics on index cards and fit them in the correct order before you begin.",simple
The typical life-span of homosexuals suggests that their activities are more destructive than smoking nd as [MASK] as drugs.,dangerous
"Airflow is as [MASK] as size, you can install the biggest condenser that will fit, but it can only perform as well as the amount of airflow it receives.",important
"It's interesting, however, that when Hollywood uses itself as the framework for a story, it's never as [MASK] as Spotlight or All The President's Men.",straightforward
"First of all, with two hit dice at first level and the possibility that gives you of doubling a constitution bonus, the monk is at least as [MASK] as a cleric in hit points, possibly just as strong as a fighter.",strong
Heat tools make our hair more porous than it already is and replenishing that protein is just as [MASK] as moisture.,important
"There were four in all and if there's one thing I have learned about bassists, it's that they are all as [MASK] as dishwater.",dull
"My father, he said, you have made my heart as [MASK] as milk.",white
"They could simply advertise the amount of SumoMe users it would be substantial, but it's no where near as [MASK] as a number in the billions.",exciting
The shop should look and smell as [MASK] as a hospital.,clean
"With our characters dead, Gary and Rob signed our ""death certificates"" on the backs of our character sheets and we all left as [MASK] as clams!",sad
"But the clubs that they are vending, are as [MASK] as a horn.",hollow
"Just as obviously, collusion and price-fixing are not nearly as [MASK] as racism or rape, but all of them are equally indefensible.",evil
Capitalism is as [MASK] as civilization.,old
"Institute of Art student Gloria Pridemore takes on Rodin at the Cleveland Museum of Art in a drawing exercise as [MASK] as museums : learning from the Litt, The Plain Dealer In December, the Cleveland museum completed an eight-year, million expansion and renovation funded by what it calls the largest private capital campaign for a cultural project in Ohio history.",old
"As they sat thus something brushed against Peter as [MASK] as a kiss , and stayed there, as if saying timidly, Can I be of any use?",light
"No , it wasn't as [MASK] as Apple's juggernaut 1.6 million iPhone 3G sold in just 3 months in the US of A but that has dramatically changed over the years -- Android now runs on over a billion devices.",big
"All of which combined to create this tart : And while it may not be as [MASK] as a trip to Cambodia with my family, it's definitely the kind of dessert that takes you out of your surroundings and takes you away to another place.",awesome
Judgment after death is as [MASK] as life.,sure
"If a person accepts any sort of payment for calling a benefit auction ( ""payment"" could be as [MASK] as a meal ) , an individual is required to have an auctioneers license.",simple
"I've reached it long ago, and now I am nearing Eighty With hair as [MASK] as snow.",white
"Maybe the http protocol is not as [MASK] as samba or the control of the player is different (wrong display ratio , stuttering).",effective
A considerable feast is set out on a platter as [MASK] as a shield.,big
You are about as [MASK] as a lump of granite.,elastic
Let's say Rivera's as [MASK] as a whistle but who checks out Vargas.,clean
The Bishop of Greathaven was as [MASK] as a ship heaving landward.,noble
The smell of evil embrocation drifted up even as [MASK] as the clouds of Heaven.,high
"For three years now I've carried this pack with me from place to place a penance a mortification a burden that weighed as [MASK] as sin, thinking never again to open it never again to be asked to take out my chisel or swing my mallet.",heavy
Yes said Gabriel though he felt as [MASK] as the thistle she had just stood on.,crushed
In one boot was thrust a riding crop unusual in that it was as [MASK] as a spear and tipped with tiny steel barbs.,long
It ran as [MASK] as clockwork hard disk floppy drive monitor and printer port.,smooth
"He gathered her to him, his voice low, crooning as [MASK] as honey on a wound. .",soothing
Then she was crying aloud as she felt her body quickening to climax and the tears wet on her own cheeks as she soared to a summit she had never hoped to experience as beautiful and spectacular and as [MASK] as the fireworks of Tivoli and like them over too soon leaving her both satiated yet hungry to renew the experience.,free
He had wooed her with hunger tempered with tenderness lifting her to heights of fulfilment she could never have even imagined before she had met him and she'd been a willing eager vessel wreaking her woman's power over him submitting joyfully to his possession until in the final moment of consummation she had robbed him of his strength leaving him as [MASK] as Samson shorn of his crowning glory.,helpless
The Havvie Blaines of this world ought to wear a sign warning decent women off and he's as [MASK] as the devil which doesn't help.,handsome
And by that maxim McAllister she's as [MASK] as sin and high time Master Neil realised it.,ugly
Her mind leapt as [MASK] as the moon somehow she knew the seal could answer her heart's desire but how could she make it happen.,high
With this Glendower rampaging round Wales as [MASK] as a bird and threatening Ruthyn every time Lord Grey turns his back.,free
Her mouth was as [MASK] as a bone but she resisted ignoring the can he proffered and stared resolutely up at him.,dry
His grip was like iron bands around her wrist his face was as [MASK] as thunder his eyes.,black
A formidable West Indian nurse bellows at me as [MASK] as the rooster himself.,sure
"I am as [MASK] as a feather, I am as happy as an angel, I am as merry as a school-boy.",light
The images were still as [MASK] as the rain that had fallen so dispiritedly on the mourners as they stood at one side of the grave while the rector had intoned the fateful words.,clear
Kate's face went as [MASK] as the towel around her head.,white
In the press in the House of Commons in reports to government departments and in popular folklore there emerged the evacuee stereotype a dirty lice-ridden and foul-mouthed urchin who wet the bed with monotonous regularity preferred fish and chips to a proper three-course meal and was about as [MASK] as a wildcat similarly the evacuee mother appeared as a negligent slut impossible to live with and having the vocabulary of a Billingsgate fish porter.,tame
Whoever painted them saw life as [MASK] as toothpaste or pretended to.,clean
The house was as [MASK] as the garden outside.,silent
It is as [MASK] as the entrance to a tomb.,twisted
Its principal hall which still stands is as long and as [MASK] as a ship with delicately carved kiosks and balconies projecting out over the lake.,narrow
The excitable Delhi poet Mutahhar of Kara went even further The moment I entered this blessed building he writes I saw a soul-animating courtyard as [MASK] as the plain of the world.,wide
I've brought out a pack of cards but when you know you've got them only to while away the hours they are as [MASK] as a stack of washing up.,exciting
If I was lying on that floor I'd be as [MASK] as a cat outside a birdcage.,hungry
The trouble was that it seemed as [MASK] as a lion apologising to a gazelle.,likely
When she asked him if they had really been as [MASK] as angels he had told her abruptly to look at the portraits just as now sensing that she had been hounded out of the house he had given her something to do a task to occupy her hands and head.,beautiful
And then he gave orders to Punch for tea to be prepared and they had a terrible time finding any china that wasn't cracked or broken and then she went on working in the pantry as [MASK] as a mouse and she could hear you both talking as clear as clear.,quiet
She keeps their home as [MASK] as a refrigerator and about as warm.,clean
Whether this was because of the weather which was warm or because they were all as [MASK] as cats or perhaps because they were actors manqu Julia had not yet decided.,curious
Watch that brickwork dry off in the sun it'll be as [MASK] as the arch here in ten minutes.,pale
She wouldn't be here now dressed to the nines for an evening that would be about as [MASK] as an attack of flu if she hadn't again responded in anger to her emotions.,thrilling
She was as [MASK] as a die and a pillar of the community.,straight
Just hanging there from one of the beams swaying as [MASK] as a leaf in the wind.,free
Around it some villagers were drinking their departed companion's health and by the looks of them were almost as [MASK] as the corpse they were mourning.,absurd
Richard Phillips is the Mary Shelley who created the monster and I have no doubts in saying that he is as [MASK] as a snake and supremely gifted in his chosen field.,mad
That was about as [MASK] as a stick of shit in the tub-water.,welcome
It darted out in front of her as [MASK] as quicksilver as Lisa was driving her rusty old Mini towards the exit of the sunlit hotel car park.,sudden
The pleasure he felt and the calmness and the determination burned as [MASK] as the trees in the forest.,dear
In the fuselage holes which are as [MASK] as fanlights showed bright sky on the other side.,big
Benjamin turned as [MASK] as a top his eyes sharp and questioning.,quick
He came back an hour later looking as [MASK] as a cat who'd stolen the cream.,smug
According to Theory Y however the expenditure of physical and mental effort in work is as [MASK] as play or rest.,natural
Standing beside the water tank on top of the caravan's portable step Pa looks as [MASK] as a Zulu in his red stole brown for me with the black umbrella held over his head at full stretch by Ma who is standing behind in the mud and wet with a white towel draped over her arm and her hair flat and all dark with water.,tall
She is as [MASK] as a chemist with her reproaches.,careful
It's as [MASK] as hell said Lydia.,hot
I have been dead for a long time and by day I circle the huge air above the hills and by night I sleep in the quiet rock as [MASK] as the rock and the little worms mean consolation as they eat me.,quiet
I would remember against my will the fragrance of coffee and hot bread the energy that had possessed me so short a time ago when I had felt [MASK] as an eel as powerful as a salmon as sure and quiet and graceful as an owl.,slender
I felt that my life fitted me as [MASK] as a garment designed for somebody else.,ill
reveals the fruit in ripeness when the floss inside is ready to be plucked as [MASK] as the lock of hair I keep with me always from your dear golden head.,soft
He had it then as [MASK] as a map of a well - charted route unfolded on the captain 's table what lay in store for him and for the settlement though the islanders had not burned wet leaves and swelled white smoke into a pillar of cloud to issue a warning the signal might as well have been as clear.,clear
I was given the opportunity to have a rehearsal with him but I declined because I am not like the professionals who can rehearse in detail and then put it over as [MASK] as a daisy when the time comes.,fresh
She rode along swaggering like a man till she came to where the lane turned into the field and there she called out as [MASK] as brass now please the powers I may find a tiger in the field.,bold
By the middle of the century chamber cantatas were being written all over Italy the composers were as [MASK] as the madrigalists of the previous century.,numerous
The treatment of the sky and of the areas between the various landscape objects the boats lighthouses and breakwaters in terms of the same facets or pictorial units into which the objects themselves are dissolved has the effect of making space seem as [MASK] as material one might almost say as pictorial as the solid objects themselves.,real
The dyed black hair was as [MASK] as skin over his head except at the front where there was a curly fringe like the edge of a pie-crust.,tight
But more than that it was the shock a feeling that left his body as [MASK] as ice and sent these involuntary convulsions through him.,cold
It was as [MASK] as a glass of lager.,cold
Because to make a microscope preparation means that the tissue has to be fixed and stained what one sees always looks as if it is a very rigid structure but in the living organism the dendritic pattern of neurons is as [MASK] as the branches of a growing tree in a gentle breeze so changed branching patterns are perhaps not so hard to envisage.,mobile
It was as [MASK] as a stone worn by aeons of tides on the seashore.,blank
The house was as [MASK] as death as the inside of a skull but the year was 1953 I was an atheist and an absolute non-believer in spiritualism ghosts and all that mumbo-jumbo.,quiet
I hesitated a moment then saw her face as [MASK] as the door behind her and gave up.,blank
She clung to him and his mouth found hers and she tasted as fresh and as [MASK] as the morning and desire had exploded within him and he thought that after all he had been wrong once would never be sufficient he wanted her for always he wanted to be with her to share everything with her.,new
It seemed an arid mountain as [MASK] as a chalk down in Sussex.,dry
"It was built of boards, so that the sun made it as [MASK] as an oven.",hot
He was as [MASK] as a raspberry .,purple
"His room was as [MASK] as pitch with the thick darkness (for the shutters were close fastened through fear of robbers), and so I knew that he could not see the opening of the door, and I kept pushing it on steadily, steadily.",black
"You're fun to have around, but this kid is about as [MASK] as a marshmallow!",funny
Guy at Table 5 is as [MASK] as a turd in a toilet bowl while everyone else is wondering why the restaurant just get so hot and stagnant.,happy
The Hollywood action hero is as [MASK] as movies.,old
"For two weeks , he could get as [MASK] as a firecracker.",hot
" she said, smiling as [MASK] as honey , and creeping close up.",sweet
He was as [MASK] as a rail.,skinny
Her eyes were as [MASK] as saucers as her own crotch came into view!,wide
"Mom : You were as [MASK] as an anchor, but I am a certified American as is your dad.",heavy
"On grounds of time, the judge heard just 22 cases before coming to his conclusion that the men before him were as [MASK] as sin.",guilty
"Seeing your hair not reverting back at this point, you may be hyperventilating or perhaps you're as [MASK] as a cucumber or not!",calm
"He was silent like a lamb being led to the butcher, as [MASK] as a sheep having its wool cut off.",quiet
"So, what exactly makes a wine as [MASK] as gold?",good
They are as [MASK] as gold and I believe they wish to remain long term tenants and so wish to offer them a SPT.,good
Sixteen is as [MASK] as a sunrise.,beautiful
they looked as [MASK] as saucers in the light of the moon.,big
My Benelli is as [MASK] as glass and you can really let em rip.,smooth
It's a tale as [MASK] as time.,old
judgment is as [MASK] as death.,sure
"Then we have the characters that don't quite fit either bill, the wonderful anti-heroes such as Watchmen's Rorschach or the Hulk , characters which can either have a strange set of morals that are almost as [MASK] as a villains or those who lose control and can not help their actions despite having them held against them.",sinister
And they are becoming more picky because the kids audience is just as [MASK] as adults.,sophisticated
"Then I took the sinful thing, the calf that you had made, and burned it with fire and crushed it, grinding it very small, until it was as [MASK] as dust.",fine
"With Ruta, it is definitely a case of the age-old adage that change is as [MASK] as a rest.",good
"A four-and-a-half minute instrumental, relying heavily on Quinns guitar and Reeses piano, it comes across as [MASK] as a lullaby.",gentle
"Grandeur was his forte, but he could be as [MASK] as a child and as tender as a mother.",simple
"They have neglected His call, ""Come now , and let us reason together, saith the Lord: though your sins be as scarlet, they shall be as [MASK] as snow"".",white
And he always cuts me off before I explain that US dollars are as [MASK] as bitcoin.,virtual
Proverbial tail is as [MASK] as a shovel.,big
Katy is a Bengal and was as [MASK] as a kitten until she died at age 15.,playful
Hunting packs are capable of running down prey which is  as [MASK] as kudu and zebra (they can reach speeds of up to 70khp)!,large
They are as [MASK] as a tree and as big around as a church.,tall
"It was so feminine, I was as [MASK] as a girl in her clothes.",pretty
They're not quite as [MASK] as racquetballs or topspin as tennis balls.,lively
"It worked and though I was still as [MASK] as heck, I could swallow it and get on with it.",nervous
"When I was finished sanding, it was as [MASK] as a babyswell, you can imagine.",smooth
"It was the perfect combination of sweet, salty, and was almost as [MASK] as a dessert!",good
"That would be nonsense, the Red Queen shook her head , You may call it ""nonsense"" if you like , she said , but I've heard nonsense , compared with which that would be as [MASK] as a dictionary !",sensible
"History and myths punctuate the star gazing , drawing the listener into realising that they are engaging in an activity that is as [MASK] as humanity's curiosity .",old
So spoiled to taste tuscan olive oil that is as [MASK] as a drink !,delicious
"Whatever you need , you'll find our products and their performance  are as [MASK] as gold!",good
"A woodland inn wanders past , as [MASK] as a barrack .",big
"yet , come thou and thy five men , and if I do not leave you all as [MASK] as a doornail , I pray God I may never eat grass more .",dead
"You will therefore permit me to repeat , emphatically , that Marley was as [MASK] as a doornail .",dead
"And then there came a second noise , a whisper of sound which is as [MASK] as a breath .",faint
"Having gathered up the books , he captured Sylvie , and stowed her away under his palett, where she nestled as [MASK] as a mouse , her head just peeping forth .",quiet
"We got a taste of the new version in the most recent trailer for Beauty and the Beast , but now you can listen to that new tale as [MASK] as time in its entirety .",old
"Coming into the game , Morrow , who was celebrating his 27th birthday , looked as [MASK] as gold .",good
"Even worse , folks are about as [MASK] as a plate of lemon-dressed asparagus , or they're just too down-to-Earth for reality TV , so they do n't do much .",interesting
As they say Love is blind but they also say that a nod is as [MASK] as a wink to a blind horse .,good
"In a culture that offers no grace for the imperfect , the concept of ""sin"" is as [MASK] as shrimp and grits .",foreign
"The finished result quite easy to do once you know how , even if you haven't had any practice or experience of paper folding before was as [MASK] as a rock .",solid
The Dornish prince had gone as [MASK] as milk .,white
Some of them are frail physically but are as [MASK] as a button in their minds.,bright
No countered Barney she seems as [MASK] as a pig in poop.,happy
I'm as [MASK] as a kite and there's no champagne in the orange juice.,high
Even though to my mind Bambi Lorrimore and Daffodil Quentin were as [MASK] as salt and strawberries the two women were again positioned opposite each other bound there by the attraction between their men.,comptiable
Whichever room you choose you can make it feel as [MASK] as a coat of empty paint with a coat of paint.,fresh
Her heart felt as [MASK] as the cage in her hands.,empty
You're as [MASK] as a bug in a rug here Myles.,close
"It's small quick a touch faster than the BJ - 200, as [MASK] as an inkjet can be and fairly cheap.",quiet
It's as [MASK] as death out there.,dark
The stone flew in the air across the surface of the water skimming as [MASK] as a bird but only because it bounced on that surface every now and then and refused to sink at the first contact.,free
She watched him gazing amorously at those twin orbs as [MASK] as marble and as plump as pigeons.,white
She marched into his big library as [MASK] as brass and stood in front of his favourite chair.,bold
You were as [MASK] as hell after my bottom.,hot
